{
  "schema_version": "1.0.0",
  "schema_url": "https://schemas.chill.dev/behavior/v1/envelope.schema.json",
  "record_id": "0190f2a0-1001-7000-8000-000000000012",
  "subject_id": "0190f2a0-1000-7000-8000-000000000006",
  "kind": "journey",
  "operation": "start",
  "name": "cat.adoption",
  "tenant": {
    "organization_id": "org_internal",
    "project_id": "project_chill",
    "environment_id": "development"
  },
  "source": {
    "platform": "apple",
    "installation_id": "8c735b90-6f71-4d73-9b16-6a42066f3d31"
  },
  "context": {
    "session_id": "0190f29f-ff00-7000-8000-000000000001",
    "journey_id": "0190f2a0-1000-7000-8000-000000000006"
  },
  "clock": {
    "occurred_at_unix_nano": "1721000000000000000",
    "observed_at_unix_nano": "1721000000100000000",
    "sequence_number": 305
  },
  "instrumentation": {
    "name": "dev.chill.swift.macro",
    "version": "0.1.0"
  },
  "resource": {
    "attributes": {
      "service.name": "example.ios"
    }
  },
  "annotations": {
    "adoption.flow": "standard"
  },
  "privacy": {
    "policy_version": "internal-v1",
    "capture_class": "analytics",
    "consent": "granted",
    "redaction_state": "none",
    "annotation_classifications": {
      "adoption.flow": "internal"
    }
  },
  "payload": {
    "definition": "cat.adoption",
    "step": "started"
  }
}
