{
  "schema_version": "1.0.0",
  "schema_url": "https://schemas.chill.dev/behavior/v1/envelope.schema.json",
  "record_id": "0190f2a0-0201-7000-8000-000000000013",
  "subject_id": "0190f2a0-0200-7000-8000-000000000003",
  "kind": "page",
  "operation": "start",
  "name": "cat",
  "tenant": {
    "organization_id": "org_internal",
    "project_id": "project_chill",
    "environment_id": "development"
  },
  "source": {
    "platform": "apple",
    "installation_id": "8c735b90-6f71-4d73-9b16-6a42066f3d31"
  },
  "context": {
    "session_id": "0190f29f-ff00-7000-8000-000000000001",
    "page": {
      "surface_id": "0190f29f-fe00-7000-8000-000000000010",
      "instance_id": "0190f2a0-0200-7000-8000-000000000003",
      "path": ["app", "cats", "cat"],
      "path_instance_ids": [
        "0190f2a0-0000-7000-8000-000000000010",
        "0190f2a0-0100-7000-8000-000000000011",
        "0190f2a0-0200-7000-8000-000000000003"
      ]
    }
  },
  "clock": {
    "occurred_at_unix_nano": "1721000000200000000",
    "observed_at_unix_nano": "1721000000300000000",
    "sequence_number": 309
  },
  "instrumentation": {
    "name": "dev.chill.swiftui",
    "version": "0.1.0"
  },
  "resource": {
    "attributes": {
      "service.name": "example.ios"
    }
  },
  "annotations": {
    "cat.id": "cat_12345"
  },
  "privacy": {
    "policy_version": "internal-v1",
    "capture_class": "analytics",
    "consent": "granted",
    "redaction_state": "none",
    "annotation_classifications": {
      "cat.id": "pseudonymous_identifier"
    }
  },
  "payload": {
    "surface_id": "0190f29f-fe00-7000-8000-000000000010",
    "instance_id": "0190f2a0-0200-7000-8000-000000000003",
    "path": ["app", "cats", "cat"],
    "path_instance_ids": [
      "0190f2a0-0000-7000-8000-000000000010",
      "0190f2a0-0100-7000-8000-000000000011",
      "0190f2a0-0200-7000-8000-000000000003"
    ],
    "relation": "push",
    "exposure": "foreground",
    "focused": true,
    "cause": "navigate",
    "navigation_id": "0190f2a0-0300-7000-8000-000000000012",
    "visibility_ratio": 1
  }
}
